
{
    "$schema": "https://raw.githubusercontent.com/benjaminchlee/Deimos/master/Assets/Deimos/Schema/morph-schema.json",
    "name": "Barchart Surface Techniques",

    "states": [
        {
            "name": "3DBarchart",
            "encoding": {
                "x": {
                    "type": "nominal"
                },
                "y": {
                    "type": "quantitative"
                },
                "height": {
                    "type": "quantitative"
                },
                "yoffsetpct": {
                    "value": -0.5
                },
                "z": {
                    "type": "nominal"
                }
            }
        },
        {
            "name": "faceted2DBarchart",
            "restrict": true,
            "encoding": {
                "x": {
                    "type": "nominal"
                },
                "y": {
                    "type": "quantitative"
                },
                "height": {
                    "type": "quantitative"
                },
                "yoffsetpct": {
                    "value": -0.5
                },
                "z": null,
                "depth": {
                    "value": 10
                },
                "facetwrap": {
                    "field": "other.encoding.z.field",
                    "type": "nominal",
                    "directions": ["x", "y"]
                }
            },
            "position": {
                "value": "touchedSurfaceIntersectionPoint"
            },
            "rotation": {
                "value": "touchedSurfaceRotation"
            }
        },
        {
            "name": "stacked2DBarchart",
            "restrict": true,
            "encoding": {
                "x": null,
                "width": {
                    "value": 10
                },
                "y": {
                    "type": "quantitative"
                },
                "height": {
                    "type": "quantitative"
                },
                "yoffsetpct": {
                    "value": -0.5
                },
                "z": {
                    "type": "nominal"
                },
                "color": {
                    "field": "other.encoding.x.field",
                    "type": "other.encoding.x.type"
                },
                "yoffset": {
                    "field": "other.encoding.x.field",
                    "type": "other.encoding.x.type"
                }
            },
            "position": {
                "value": "touchedSurfaceIntersectionPoint"
            },
            "rotation": {
                "value": "touchedSurfaceRotation * euler(0, -90, 0)"
            }
        }
    ],

    "signals": [{
            "name": "isVisTouchingSurface",
            "source": "vis",
            "target": "surface",
            "criteria": "touch",
            "value": "boolean"
        }, {
            "name": "touchedSurfaceIntersectionPoint",
            "source": "vis",
            "target": "surface",
            "criteria": "touch",
            "value": "intersection"
        }, {
            "name": "touchedSurfaceRotation",
            "source": "vis",
            "target": "surface",
            "criteria": "touch",
            "value": "rotation"
        }, {
            "name": "touchedSurfaceIntersectionAngle",
            "source": "vis",
            "target": "surface",
            "criteria": "touch",
            "value": "angle"
        }, {
            "name": "isTouchingSideways",
            "expression": "45 < touchedSurfaceIntersectionAngle && touchedSurfaceIntersectionAngle < 135"
        }
    ],

    "transitions": [
        {
            "name": "partitionBarchart",
            "states": ["3DBarchart", "faceted2DBarchart"],
            "trigger": "isVisTouchingSurface && !isTouchingSideways",
            "control": {
                "timing": 1.5,
                "easing": "easeoutcirc",
                "interrupted": "ignore",
                "staging": {
                    "encoding": [0, 0.65],
                    "position": [0.65, 1],
                    "rotation": [0.65, 1]
                }
            },
            "bidirectional": true,
            "priority": 1
        },
        {
            "name": "stackingBarchart",
            "states": ["3DBarchart", "stacked2DBarchart"],
            "trigger": "isVisTouchingSurface && isTouchingSideways",
            "control": {
                "timing": 1.5,
                "easing": "easeoutcirc",
                "interrupted": "ignore",
                "staging": {
                    "encoding": [0, 0.65],
                    "position": [0.65, 1],
                    "rotation": [0.65, 1]
                }
            },
            "bidirectional": true,
            "priority": 1
        }
    ]
}
